{
  "$schema": "http://json-schema.org/draft-07/schema#",
  "$id": "okrobo:competition:v0",
  "title": "OKROBO Competition Definition v0",
  "description": "A self-contained challenge: an arena (embedded, field-for-field identical to contracts/world/v1) plus a list of objectives a student's own robot program is scored against while it runs. This document carries no simulation behavior of its own -- scoring is computed entirely in apps/studio/src/compete/score.ts from the robot's own already-exposed per-tick pose, never inside the student-facing API or the engine. Units: meters, radians, seconds -- same as contracts/world/v1.",
  "type": "object",
  "required": ["id", "name", "robot", "arena", "objectives"],
  "additionalProperties": false,
  "properties": {
    "id": {
      "type": "string",
      "pattern": "^[a-z][a-z0-9-]{1,63}$",
      "description": "Stable identifier, kebab-case (matches contracts/pack/v0's own id convention)."
    },
    "name": { "type": "string", "minLength": 1 },
    "description": { "type": "string" },
    "robot": {
      "const": "car",
      "description": "Which robot kind this competition targets. Only 'car' exists in v0 -- an explicit enum (not assumed) so 'arm'/'drone' can be added later with no version fork."
    },
    "arena": {
      "type": "object",
      "description": "Embedded, not referenced: nothing in the pack system today lets one content file reference another, and a competition should be one portable document a student can share on its own. Field-for-field identical to contracts/world/v1/schema.json.",
      "required": ["name", "arena_width", "arena_height", "robot_radius", "wheel_base", "start"],
      "additionalProperties": false,
      "properties": {
        "name": { "type": "string", "minLength": 1 },
        "description": { "type": "string" },
        "arena_width": { "type": "number", "exclusiveMinimum": 0 },
        "arena_height": { "type": "number", "exclusiveMinimum": 0 },
        "robot_radius": { "type": "number", "exclusiveMinimum": 0 },
        "wheel_base": { "type": "number", "exclusiveMinimum": 0 },
        "start": {
          "type": "object",
          "required": ["x", "y", "theta"],
          "additionalProperties": false,
          "properties": {
            "x": { "type": "number" },
            "y": { "type": "number" },
            "theta": { "type": "number" }
          }
        },
        "obstacles": {
          "type": "array",
          "maxItems": 16,
          "items": {
            "type": "object",
            "required": ["x", "y"],
            "additionalProperties": false,
            "properties": {
              "x": { "type": "number" },
              "y": { "type": "number" },
              "width": { "type": "number", "exclusiveMinimum": 0 },
              "height": { "type": "number", "exclusiveMinimum": 0 },
              "color": {
                "type": "array",
                "minItems": 3,
                "maxItems": 3,
                "items": { "type": "integer", "minimum": 0, "maximum": 255 }
              },
              "label": { "type": "string" }
            }
          }
        }
      }
    },
    "objectives": {
      "type": "array",
      "minItems": 1,
      "description": "Independent and unordered in v0 -- every objective is evaluated every tick, none gates another. Ordered checkpoint sequences are a deliberate later addition (see docs/decisions/competition-arena-definition-scoring.md), not this version.",
      "items": {
        "oneOf": [
          {
            "type": "object",
            "required": ["type", "x", "y", "radius", "points"],
            "additionalProperties": false,
            "description": "Awarded once, the first time the robot's own position enters this circle. Staying inside, or re-entering, never re-awards it.",
            "properties": {
              "type": { "const": "reach_zone" },
              "x": { "type": "number" },
              "y": { "type": "number" },
              "radius": { "type": "number", "exclusiveMinimum": 0 },
              "points": { "type": "number", "exclusiveMinimum": 0 }
            }
          },
          {
            "type": "object",
            "required": ["type", "penalty_per_hit"],
            "additionalProperties": false,
            "description": "Deducts penalty_per_hit each time the robot's own circle (radius = arena.robot_radius) starts overlapping an obstacle box it wasn't already overlapping -- edge-triggered per obstacle, so one continuous overlap costs one penalty, not one per tick.",
            "properties": {
              "type": { "const": "avoid_obstacle_collision" },
              "penalty_per_hit": { "type": "number", "minimum": 0 }
            }
          },
          {
            "type": "object",
            "required": ["type", "seconds"],
            "additionalProperties": false,
            "description": "At most one per competition (enforced by the hand-written validator, not expressible here). Ends the run once elapsed time reaches this many seconds.",
            "properties": {
              "type": { "const": "time_limit" },
              "seconds": { "type": "number", "exclusiveMinimum": 0 }
            }
          }
        ]
      }
    }
  }
}
